{
  "schema": "himind.video.style-pack.v1",
  "id": "lyric-karaoke",
  "version": "1.0.0",
  "name": "歌词卡拉 OK",
  "description": "舞台灯光、逐字卡拉 OK 填充、波形与歌词时间轴。",
  "renderer": "browser-code",
  "entry": "render.mjs",
  "video_out": "out/video.mp4",
  "duration_seconds": 10,
  "preview": {
    "sheet_out": "out/check/sheet.jpg",
    "strip_out": "out/check/strip.jpg",
    "stills_out": "out/stills"
  },
  "license": "MIT",
  "network": {
    "mode": "none",
    "allow": []
  },
  "delivery": {
    "web": true,
    "web_width": 1280,
    "web_crf": 23,
    "max_master_mb": 50
  },
  "attribution": "HiMind original lyric-karaoke style pack"
}
