{
  "schema": "himind.video.style-pack.v1",
  "id": "3d-product-reel",
  "version": "1.0.0",
  "name": "3D 产品展示",
  "description": "three.js 工作室产品展示，金属材质、环形光效、浮动卖点与电影感镜头。",
  "renderer": "browser-code",
  "entry": "render.mjs",
  "video_out": "out/video.mp4",
  "duration_seconds": 10,
  "preview": {
    "sheet_out": "out/check/sheet.jpg",
    "strip_out": "out/check/strip.jpg",
    "stills_out": "out/stills"
  },
  "license": "MIT",
  "network": {
    "mode": "none",
    "allow": []
  },
  "delivery": {
    "web": true,
    "web_width": 1280,
    "web_crf": 23,
    "max_master_mb": 50
  },
  "attribution": "HiMind original 3d-product-reel style pack",
  "quality": {
    "text_audit": {
      "enabled": true,
      "page": "reel/index.html",
      "times": "1.5,5,8.5"
    },
    "banding_gate": true
  }
}