{
  "schema": "himind.video.style-pack.v1",
  "id": "brand-lookbook",
  "version": "1.0.0",
  "name": "品牌手册",
  "description": "品牌字体、色板、网格规范、原则与视觉识别卡片。",
  "renderer": "browser-code",
  "entry": "render.mjs",
  "video_out": "out/video.mp4",
  "duration_seconds": 10,
  "preview": {
    "sheet_out": "out/check/sheet.jpg",
    "strip_out": "out/check/strip.jpg",
    "stills_out": "out/stills"
  },
  "license": "MIT",
  "network": {
    "mode": "none",
    "allow": []
  },
  "delivery": {
    "web": true,
    "web_width": 1280,
    "web_crf": 23,
    "max_master_mb": 50
  },
  "attribution": "HiMind original brand-lookbook style pack"
}
