{
  "schema": "himind.video.style-pack.v1",
  "id": "neon-arcade",
  "version": "1.0.0",
  "name": "霓虹街机",
  "description": "街机 HUD、像素星光、霓虹分数、扫描线与连击反馈。",
  "renderer": "browser-code",
  "entry": "render.mjs",
  "video_out": "out/video.mp4",
  "duration_seconds": 10,
  "preview": {
    "sheet_out": "out/check/sheet.jpg",
    "strip_out": "out/check/strip.jpg",
    "stills_out": "out/stills"
  },
  "license": "MIT",
  "network": {
    "mode": "none",
    "allow": []
  },
  "delivery": {
    "web": true,
    "web_width": 1280,
    "web_crf": 23,
    "max_master_mb": 50
  },
  "attribution": "HiMind original neon-arcade style pack"
}
